skills,cgpa,career
"pandas, hypothesis testing, tableau, data cleaning, python, sql, reporting, data visualization, excel, machine learning, power bi",9.19,Data Analyst
"networking, docker, aws, ci/cd, devops, security, azure, penetration testing",6.38,Cloud Engineer
"networking, devops, linux, ci/cd, firewalls, kubernetes, aws, ethical hacking, docker, terraform, monitoring, azure",7.43,Cloud Engineer
"html, react, accessibility, typescript, responsive design, ui design, web performance, javascript, redux, css",7.75,Frontend Developer
"api development, databases, authentication, java, flask, python",6.66,Backend Developer
"deep learning, pytorch, machine learning, python, data preprocessing, flask, system design, mathematics, computer vision, neural networks",7.1,AI Engineer
"node.js, system design, django, flask, databases, sql, authentication, api development, java",6.49,Backend Developer
"machine learning, pandas, nlp, sql, numpy, feature engineering, hypothesis testing, python, data visualization",7.97,Data Scientist
"html, typescript, web performance, ui design, responsive design, redux, react",9.5,Frontend Developer
"kubernetes, docker, devops, networking, aws, linux",7.03,Cloud Engineer
"ethical hacking, networking, risk assessment, penetration testing, siem, cryptography",7.07,Cyber Security Analyst
"flask, django, databases, python, system design, java",8.48,Backend Developer
"react, problem solving, testing, algorithms, debugging, python, java, data structures, oop, git, software design",6.07,Software Developer
"debugging, git, software design, data structures, problem solving, python, algorithms, testing, java, oop",9.59,Software Developer
"sql, pandas, machine learning, statistics, feature engineering, scikit-learn, python, data visualization, hypothesis testing, numpy",7.61,Data Scientist
"typescript, node.js, ui design, javascript, web performance, accessibility, responsive design, api development, redux, css",9.26,Frontend Developer
"node.js, django, authentication, java, system design, sql, api development",7.2,Backend Developer
"sql, power bi, pandas, python, tableau, reporting, statistics",6.74,Data Analyst
"siem, firewalls, incident response, networking, security, devops, penetration testing, cryptography, risk assessment, linux",8.46,Cyber Security Analyst
"django, databases, python, sql, system design, java, node.js, authentication, flask",8.67,Backend Developer
"testing, oop, data structures, debugging, git, problem solving, java, python, algorithms, software design",8.98,Software Developer
"ci/cd, kubernetes, terraform, networking, docker, linux, devops, aws, azure, monitoring",8.01,Cloud Engineer
"kubernetes, monitoring, linux, docker, networking, terraform, azure, aws, devops, ci/cd",8.05,Cloud Engineer
"aws, azure, terraform, kubernetes, linux, git, docker, devops, networking, ci/cd, java",8.34,Cloud Engineer
"cryptography, linux, security, siem, firewalls, penetration testing, risk assessment",9.48,Cyber Security Analyst
"python, linux, kubernetes, terraform, monitoring, data cleaning, networking, aws, azure, devops",6.89,Cloud Engineer
"linux, azure, docker, ci/cd, monitoring, kubernetes, aws, networking, terraform",9.77,Cloud Engineer
"firewalls, risk assessment, cryptography, ethical hacking, siem, security",7.22,Cyber Security Analyst
"git, java, data structures, oop, software design, algorithms",6.39,Software Developer
"python, pandas, hypothesis testing, feature engineering, sql, scikit-learn",6.82,Data Scientist
"python, tableau, pandas, reporting, data cleaning, power bi, sql, statistics, excel, data visualization",7.59,Data Analyst
"scikit-learn, python, pandas, machine learning, data visualization, sql, statistics, feature engineering, hypothesis testing",6.61,Data Scientist
"networking, siem, risk assessment, cryptography, ethical hacking, penetration testing, firewalls, security, incident response",7.58,Cyber Security Analyst
"ui design, html, typescript, responsive design, accessibility, css, web performance",9.23,Frontend Developer
"reporting, python, power bi, pandas, sql, data visualization, tableau",8.2,Data Analyst
"flask, cryptography, django, linux, python, system design, sql, databases, authentication, java, node.js, api development",8.27,Backend Developer
"python, testing, data structures, software design, problem solving, oop, git, algorithms",6.89,Software Developer
"reporting, statistics, data visualization, power bi, data cleaning, pandas, excel",6.23,Data Analyst
"excel, statistics, pandas, power bi, python, data cleaning",8.5,Data Analyst
"flask, databases, django, authentication, api development, java, python, system design, sql",8.45,Backend Developer
"javascript, typescript, testing, redux, web performance, responsive design, accessibility",7.15,Frontend Developer
"numpy, pandas, data visualization, statistics, hypothesis testing, feature engineering, flask, authentication, machine learning, python, scikit-learn",9.47,Data Scientist
"css, reporting, data cleaning, excel, javascript, data visualization, tableau, python",9.81,Data Analyst
"django, flask, authentication, api development, sql, node.js, system design",6.82,Backend Developer
"linux, penetration testing, cryptography, networking, incident response, ethical hacking, siem, firewalls, risk assessment, security",8.25,Cyber Security Analyst
"ethical hacking, security, cryptography, incident response, risk assessment, siem, networking",6.3,Cyber Security Analyst
"azure, terraform, ci/cd, kubernetes, devops, linux, networking, monitoring, aws, docker",8.42,Cloud Engineer
"computer vision, python, data preprocessing, tensorflow, sql, mathematics, pytorch, data visualization",9.03,AI Engineer
"devops, aws, kubernetes, linux, docker, azure, ci/cd, terraform, networking",8.91,Cloud Engineer
"python, machine learning, statistics, pandas, hypothesis testing, scikit-learn, numpy, sql, feature engineering",6.75,Data Scientist
"excel, statistics, reporting, python, data visualization, pandas",8.44,Data Analyst
"networking, firewalls, incident response, penetration testing, risk assessment, ethical hacking, linux",7.06,Cyber Security Analyst
"data preprocessing, nlp, pytorch, python, tensorflow, mathematics, computer vision, deep learning, machine learning, neural networks",9.32,AI Engineer
"oop, python, java, debugging, algorithms, software design, problem solving, testing, git",7.21,Software Developer
"networking, linux, aws, ci/cd, devops, monitoring, docker",7.13,Cloud Engineer
"django, java, api development, machine learning, node.js, python, sql, system design",8.7,Backend Developer
"api development, node.js, flask, databases, java, python, authentication, django, sql, system design",7.5,Backend Developer
"css, javascript, web performance, responsive design, html, redux, accessibility",7.64,Frontend Developer
"css, javascript, accessibility, react, responsive design, redux",6.09,Frontend Developer
"flask, system design, authentication, api development, node.js, python, django, sql, databases, java",6.01,Backend Developer
"data visualization, sql, python, data cleaning, pandas, power bi, reporting, statistics, excel",6.95,Data Analyst
"problem solving, testing, debugging, java, python, data structures, git, algorithms, software design, oop",6.96,Software Developer
"tensorflow, python, neural networks, machine learning, mathematics, deep learning, pytorch, computer vision",9.7,AI Engineer
"ci/cd, linux, networking, aws, docker, monitoring, kubernetes, azure, terraform",6.71,Cloud Engineer
"scikit-learn, data visualization, hypothesis testing, machine learning, numpy, statistics, feature engineering, python, pandas",7.87,Data Scientist
"sql, python, excel, tableau, pandas, statistics",7.65,Data Analyst
"java, git, debugging, python, data structures, problem solving, testing, docker, software design, algorithms, kubernetes, oop",9.22,Software Developer
"kubernetes, monitoring, devops, linux, terraform, scikit-learn, aws, docker",7.98,Cloud Engineer
"typescript, accessibility, html, javascript, react, css, web performance",6.81,Frontend Developer
"data preprocessing, computer vision, tensorflow, neural networks, nlp, cryptography, python, deep learning",9.17,AI Engineer
"java, data structures, algorithms, git, debugging, oop, testing",6.65,Software Developer
"terraform, ci/cd, incident response, aws, kubernetes, devops, docker, monitoring",7.25,Cloud Engineer
"scikit-learn, numpy, machine learning, data visualization, feature engineering, statistics, hypothesis testing, pandas, python",9.55,Data Scientist
"pandas, numpy, scikit-learn, feature engineering, statistics, machine learning, hypothesis testing, data visualization",8.02,Data Scientist
"tableau, sql, statistics, reporting, excel, data cleaning, python, power bi, pandas",8.9,Data Analyst
"javascript, html, ui design, web performance, react, redux, css, typescript, accessibility, responsive design",8.35,Frontend Developer
"flask, system design, django, python, authentication, java, sql, node.js, api development, databases",7.47,Backend Developer
"reporting, statistics, python, sql, risk assessment, excel, linux, data visualization, tableau",6.46,Data Analyst
"machine learning, feature engineering, sql, numpy, accessibility, python, data visualization",8.12,Data Scientist
"python, pandas, data visualization, machine learning, numpy, scikit-learn, api development, feature engineering, flask",8.07,Data Scientist
"web performance, responsive design, redux, typescript, accessibility, ui design, css, react",8.44,Frontend Developer
"oop, java, algorithms, problem solving, git, data structures, python, testing",9.12,Software Developer
"mathematics, tensorflow, data preprocessing, computer vision, neural networks, deep learning, pytorch, nlp, machine learning, python",6.9,AI Engineer
"oop, debugging, git, testing, software design, python, algorithms",6.73,Software Developer
"linux, aws, devops, docker, terraform, kubernetes, networking, typescript",8.26,Cloud Engineer
"react, javascript, accessibility, ui design, typescript, responsive design, redux, css, web performance",6.06,Frontend Developer
"data visualization, sql, statistics, pandas, data cleaning, tableau, power bi, excel, python, reporting",8.49,Data Analyst
"css, ui design, typescript, responsive design, accessibility, javascript, web performance",8.24,Frontend Developer
"python, sql, data visualization, feature engineering, pandas, numpy",7.55,Data Scientist
"testing, problem solving, debugging, software design, java, algorithms, git, oop",7.41,Software Developer
"statistics, sql, pandas, feature engineering, data visualization, python, numpy, scikit-learn, hypothesis testing, machine learning",8.75,Data Scientist
"cryptography, firewalls, siem, incident response, penetration testing, security, risk assessment, networking, ethical hacking",8.22,Cyber Security Analyst
"statistics, python, data cleaning, sql, api development, power bi, data visualization",7.81,Data Analyst
"sql, machine learning, scikit-learn, hypothesis testing, pandas, feature engineering",8.72,Data Scientist
"machine learning, numpy, python, sql, hypothesis testing, pandas, statistics, scikit-learn, feature engineering, data visualization",9.51,Data Scientist
"hypothesis testing, scikit-learn, numpy, sql, pandas, statistics, feature engineering, data visualization, machine learning",7.59,Data Scientist
"python, algorithms, java, oop, software design, testing, data structures, debugging, problem solving",6.17,Software Developer
"api development, django, web performance, databases, python, java, flask, authentication, system design, sql",6.8,Backend Developer
"flask, django, authentication, node.js, databases, java, api development, system design, python",6.85,Backend Developer
"machine learning, python, reporting, hypothesis testing, statistics, pandas, scikit-learn, sql, data visualization, feature engineering, numpy",6.81,Data Scientist
"reporting, data cleaning, statistics, pandas, data visualization, python",8.89,Data Analyst
"reporting, pandas, power bi, sql, security, excel, data visualization, python, tableau, statistics, data cleaning",7.7,Data Analyst
"kubernetes, azure, networking, terraform, devops, aws, monitoring",7.15,Cloud Engineer
"linux, risk assessment, security, siem, penetration testing, networking, cryptography, incident response",6.1,Cyber Security Analyst
"data cleaning, data visualization, pandas, excel, sql, power bi, statistics, tableau",9.69,Data Analyst
"html, hypothesis testing, web performance, ui design, css, redux, accessibility, responsive design, typescript, react",8.27,Frontend Developer
"firewalls, ethical hacking, incident response, linux, siem, networking, penetration testing, risk assessment",8.77,Cyber Security Analyst
"numpy, python, ui design, scikit-learn, feature engineering, machine learning, data visualization, pandas, hypothesis testing",6.21,Data Scientist
"data visualization, reporting, power bi, sql, python, statistics, tableau, excel",6.99,Data Analyst
"mathematics, data preprocessing, tensorflow, neural networks, nlp, machine learning, pytorch, python",9.1,AI Engineer
"pandas, data visualization, statistics, numpy, scikit-learn, machine learning, sql",9.43,Data Scientist
"devops, networking, azure, kubernetes, aws, ci/cd",8.55,Cloud Engineer
"ethical hacking, risk assessment, statistics, linux, incident response, security, siem, firewalls, cryptography, networking, penetration testing",6.88,Cyber Security Analyst
"accessibility, redux, javascript, react, html, typescript, web performance, ui design, responsive design",8.67,Frontend Developer
"ui design, redux, typescript, react, accessibility, css, responsive design, javascript, web performance, html",6.67,Frontend Developer
"java, system design, django, node.js, api development, databases",8.78,Backend Developer
"kubernetes, monitoring, aws, docker, linux, ci/cd",7.1,Cloud Engineer
"reporting, excel, power bi, pandas, sql, python, risk assessment, statistics, data cleaning, tableau",8.83,Data Analyst
"nlp, tensorflow, computer vision, neural networks, python, data preprocessing, pytorch, machine learning, mathematics",6.48,AI Engineer
"software design, data structures, python, oop, algorithms, java, git, testing",8.24,Software Developer
"risk assessment, cryptography, siem, firewalls, ethical hacking, penetration testing",9.49,Cyber Security Analyst
"accessibility, web performance, css, typescript, ui design, responsive design, html, redux",8.25,Frontend Developer
"docker, linux, aws, terraform, devops, networking, kubernetes, azure",9.53,Cloud Engineer
"aws, kubernetes, monitoring, docker, terraform, linux, networking, azure",7.81,Cloud Engineer
"javascript, responsive design, react, web performance, ui design, typescript, accessibility, firewalls, html, redux, css",7.24,Frontend Developer
"databases, sql, django, system design, authentication, python",8.94,Backend Developer
"firewalls, cryptography, incident response, risk assessment, siem, linux, security",6.01,Cyber Security Analyst
"monitoring, ci/cd, kubernetes, linux, docker, devops",8.11,Cloud Engineer
"ui design, responsive design, accessibility, html, web performance, redux",8.03,Frontend Developer
"hypothesis testing, data visualization, pandas, machine learning, numpy, statistics, scikit-learn, python, sql",9.14,Data Scientist
"redux, web performance, ui design, responsive design, react, typescript",9.42,Frontend Developer
"pandas, machine learning, hypothesis testing, python, api development, data visualization, numpy, sql, feature engineering, scikit-learn",8.02,Data Scientist
"java, api development, authentication, django, node.js, system design, databases, flask",9.87,Backend Developer
"numpy, machine learning, hypothesis testing, scikit-learn, statistics, data visualization, python, pandas",7.03,Data Scientist
"risk assessment, redux, linux, siem, html, penetration testing, security, cryptography, ethical hacking, networking, firewalls",6.99,Cyber Security Analyst
"azure, debugging, terraform, monitoring, kubernetes, linux, devops, aws, docker",6.63,Cloud Engineer
"ui design, redux, typescript, html, responsive design, javascript, react, web performance",8.5,Frontend Developer
"sql, reporting, data cleaning, devops, data visualization, networking, pandas, excel, tableau, statistics, power bi, python",6.29,Data Analyst
"kubernetes, computer vision, deep learning, mathematics, machine learning, terraform, neural networks, pytorch, python",8.57,AI Engineer
"tableau, python, sql, flask, authentication, reporting, data cleaning, power bi",6.3,Data Analyst
"software design, problem solving, git, java, cryptography, algorithms, data structures, python, oop, testing",8.97,Software Developer
"system design, api development, flask, databases, django, node.js",9.83,Backend Developer
"algorithms, java, oop, problem solving, testing, software design, git, python, data structures, debugging",9.56,Software Developer
"web performance, javascript, react, typescript, redux, responsive design, ui design, html, css, accessibility",7.36,Frontend Developer
"sql, devops, statistics, tableau, data visualization, data cleaning, excel",7.25,Data Analyst
"data cleaning, power bi, excel, tableau, python, reporting, system design, pandas",6.38,Data Analyst
"ui design, redux, javascript, responsive design, typescript, accessibility, monitoring, css, web performance",7.54,Frontend Developer
"networking, python, devops, system design, docker, terraform, linux, aws, azure, monitoring, kubernetes",6.6,Cloud Engineer
"python, ui design, css, redux, react, web performance, responsive design, html, typescript, javascript, statistics",6.58,Frontend Developer
"api development, sql, python, system design, algorithms, node.js, django, flask, java",6.93,Backend Developer
"html, web performance, responsive design, typescript, react, javascript, css, accessibility, redux, ui design",8.6,Frontend Developer
"kubernetes, docker, networking, ci/cd, devops, linux, aws",9.05,Cloud Engineer
"risk assessment, ethical hacking, siem, networking, security, cryptography",9.16,Cyber Security Analyst
"neural networks, machine learning, deep learning, data preprocessing, nlp, tensorflow, mathematics, computer vision, python",7.68,AI Engineer
"api development, authentication, django, python, system design, javascript, java, accessibility, databases",7.38,Backend Developer
"machine learning, hypothesis testing, pandas, git, data visualization, numpy, scikit-learn, debugging",6.21,Data Scientist
"aws, devops, docker, ci/cd, azure, terraform, networking, linux, kubernetes, python, feature engineering, monitoring",9.12,Cloud Engineer
"java, algorithms, oop, python, scikit-learn, problem solving, data structures, git, software design",9.12,Software Developer
"reporting, pandas, data visualization, data cleaning, python, excel, statistics, tableau, power bi, sql",8.65,Data Analyst
"sql, penetration testing, scikit-learn, networking, numpy, feature engineering, data visualization, machine learning, hypothesis testing, pandas",7.36,Data Scientist
"testing, data structures, java, algorithms, python, git, software design, debugging, oop, problem solving",6.86,Software Developer
"pytorch, machine learning, tensorflow, mathematics, neural networks, nlp, data preprocessing, computer vision",7.97,AI Engineer
"linux, firewalls, ethical hacking, networking, cryptography, security",6.36,Cyber Security Analyst
"data preprocessing, pytorch, neural networks, mathematics, computer vision, deep learning, nlp, machine learning, tensorflow",8.69,AI Engineer
"networking, firewalls, risk assessment, cryptography, linux, security, siem, ethical hacking, penetration testing",6.43,Cyber Security Analyst
"excel, pandas, statistics, data visualization, sql, networking, tableau, reporting, data cleaning, power bi, python",7.36,Data Analyst
"excel, reporting, python, data visualization, sql, pandas",9.41,Data Analyst
"hypothesis testing, python, numpy, data visualization, machine learning, scikit-learn, sql, statistics, kubernetes, docker, pandas",9.0,Data Scientist
"devops, aws, docker, networking, linux, terraform, monitoring, azure",8.67,Cloud Engineer
"web performance, html, accessibility, responsive design, typescript, javascript",8.65,Frontend Developer
"linux, ethical hacking, siem, incident response, networking, flask, authentication, risk assessment, penetration testing, cryptography, firewalls",6.24,Cyber Security Analyst
"tableau, reporting, python, api development, statistics, data cleaning, excel, power bi, pandas",6.48,Data Analyst
"deep learning, computer vision, machine learning, python, data visualization, data preprocessing, mathematics, nlp, numpy, tensorflow, neural networks, pytorch",9.57,AI Engineer
"accessibility, react, web performance, javascript, responsive design, css, ui design, redux, typescript, html",6.45,Frontend Developer
"neural networks, machine learning, tensorflow, data preprocessing, pytorch, deep learning, nlp, mathematics, python, computer vision",8.86,AI Engineer
"javascript, typescript, css, ui design, python, nlp, react, accessibility, html, redux",8.23,Frontend Developer
"deep learning, computer vision, data preprocessing, machine learning, tensorflow, redux, python, mathematics, nlp, neural networks",7.84,AI Engineer
"nlp, databases, flask, python, system design, django, java, neural networks, api development",7.42,Backend Developer
"system design, flask, python, sql, node.js, java, api development, django",6.38,Backend Developer
"scikit-learn, risk assessment, machine learning, sql, statistics, pandas, feature engineering",7.33,Data Scientist
"web performance, javascript, react, typescript, responsive design, accessibility, ui design, css, redux",7.07,Frontend Developer
"siem, risk assessment, security, cryptography, firewalls, nlp, linux, ethical hacking, incident response",9.51,Cyber Security Analyst
"data visualization, excel, data cleaning, pandas, power bi, tableau, sql, statistics",6.89,Data Analyst
"data cleaning, sql, reporting, pandas, data visualization, power bi, statistics, tableau, python, linux, excel, siem",7.32,Data Analyst
"azure, linux, terraform, ci/cd, kubernetes, networking, docker",6.55,Cloud Engineer
"networking, siem, ethical hacking, risk assessment, linux, firewalls, security",8.48,Cyber Security Analyst
"data visualization, python, sql, power bi, pandas, tableau, data cleaning, excel",6.24,Data Analyst
"data preprocessing, nlp, neural networks, python, deep learning, computer vision, mathematics, pytorch",8.64,AI Engineer
"problem solving, java, algorithms, git, oop, data structures, debugging, python, software design",7.07,Software Developer
"flask, django, authentication, node.js, databases, python, java, api development",7.36,Backend Developer
"kubernetes, mathematics, data preprocessing, computer vision, tensorflow, deep learning, neural networks",9.37,AI Engineer
"linux, docker, devops, ci/cd, azure, aws",8.74,Cloud Engineer
"python, java, data structures, testing, algorithms, software design, problem solving",9.66,Software Developer
"penetration testing, networking, firewalls, machine learning, risk assessment, siem, ethical hacking, security, cryptography",9.69,Cyber Security Analyst
"pytorch, tensorflow, data preprocessing, machine learning, python, computer vision",6.37,AI Engineer
"databases, django, system design, api development, java, sql, node.js, python, flask",7.3,Backend Developer
"cryptography, networking, ethical hacking, risk assessment, linux, siem, incident response, security, penetration testing",8.64,Cyber Security Analyst
"redux, react, risk assessment, ui design, responsive design, css, siem, html",9.73,Frontend Developer
"web performance, html, react, redux, javascript, css, accessibility, ui design",9.28,Frontend Developer
"machine learning, responsive design, ui design, neural networks, typescript, react, html, redux, javascript, web performance, accessibility",9.77,Frontend Developer
"statistics, hypothesis testing, machine learning, python, sql, feature engineering, data visualization, pandas",6.54,Data Scientist
"sql, scikit-learn, networking, statistics, pandas, hypothesis testing, firewalls, machine learning",6.17,Data Scientist
"deep learning, python, data preprocessing, nlp, computer vision, tensorflow, mathematics, pytorch",7.35,AI Engineer
"node.js, java, sql, api development, databases, authentication, django, system design, python, flask",7.91,Backend Developer
"databases, python, system design, django, sql, node.js, api development, authentication, penetration testing",8.86,Backend Developer
"tableau, flask, authentication, java, node.js, sql, databases, python, api development, django, system design",9.39,Backend Developer
"python, api development, node.js, databases, authentication, system design, flask, django, sql, java, penetration testing",6.17,Backend Developer
"problem solving, software design, testing, data structures, java, python, algorithms",8.87,Software Developer
"javascript, system design, flask, databases, sql, authentication, java, api development, node.js, django",6.02,Backend Developer
"scikit-learn, hypothesis testing, statistics, machine learning, pandas, sql, python, feature engineering, data visualization",8.49,Data Scientist
"monitoring, azure, kubernetes, aws, docker, terraform",9.44,Cloud Engineer
"incident response, networking, risk assessment, typescript, firewalls, linux, react, security",9.15,Cyber Security Analyst
"data preprocessing, machine learning, deep learning, siem, computer vision, python, tensorflow, pytorch, mathematics, nlp, penetration testing, neural networks",7.28,AI Engineer
