skills,cgpa,career
"css, accessibility, ui design, redux, javascript, react, web performance, python, responsive design, typescript",9.19,Frontend Developer
"machine learning, neural networks, data preprocessing, python, mathematics, pytorch, computer vision, nlp, tensorflow, deep learning",8.14,AI Engineer
"ui design, react, html, responsive design, accessibility, css, web performance, javascript, redux",9.87,Frontend Developer
"nlp, deep learning, mathematics, python, machine learning, data preprocessing, pytorch, tensorflow, computer vision, neural networks",9.22,AI Engineer
"tensorflow, machine learning, mathematics, python, neural networks, pytorch, data preprocessing, nlp, deep learning",6.17,AI Engineer
"typescript, responsive design, css, javascript, html, react, ui design, web performance, redux",7.6,Frontend Developer
"web performance, react, html, javascript, css, accessibility, ui design, typescript, redux",6.8,Frontend Developer
"responsive design, redux, accessibility, ui design, css, javascript, html, typescript",6.33,Frontend Developer
"deep learning, redux, tensorflow, nlp, python, data preprocessing, mathematics, react",8.91,AI Engineer
"git, problem solving, testing, algorithms, python, debugging",9.65,Software Developer
"statistics, numpy, python, data visualization, scikit-learn, sql, pandas, feature engineering, machine learning",8.42,Data Scientist
"web performance, ui design, css, html, redux, javascript, system design, accessibility",9.5,Frontend Developer
"risk assessment, linux, firewalls, siem, penetration testing, networking, security, ethical hacking, cryptography",8.09,Cyber Security Analyst
"firewalls, cryptography, sql, siem, networking, security, ethical hacking",8.69,Cyber Security Analyst
"linux, azure, networking, aws, devops, terraform, kubernetes, monitoring",6.69,Cloud Engineer
"api development, authentication, django, python, system design, node.js, flask, java, sql, databases",8.22,Backend Developer
"reporting, tableau, pandas, excel, data cleaning, power bi, statistics, sql, python",6.11,Data Analyst
"java, problem solving, debugging, software design, oop, git, reporting, data cleaning, data structures, testing",7.75,Software Developer
"terraform, ci/cd, networking, azure, docker, aws, kubernetes, devops",6.85,Cloud Engineer
"azure, monitoring, ci/cd, kubernetes, terraform, docker, devops, cryptography, linux, aws, networking",7.06,Cloud Engineer
"computer vision, mathematics, machine learning, deep learning, tensorflow, nlp, pytorch, neural networks, ethical hacking, python, data preprocessing",8.63,AI Engineer
"siem, security, firewalls, risk assessment, penetration testing, cryptography, ethical hacking",7.25,Cyber Security Analyst
"web performance, responsive design, react, css, accessibility, ui design, typescript, html, redux, javascript",8.3,Frontend Developer
"sql, django, databases, python, node.js, java, flask, authentication",8.79,Backend Developer
"tensorflow, neural networks, machine learning, data preprocessing, python, pytorch, nlp, deep learning, computer vision",7.45,AI Engineer
"feature engineering, sql, python, numpy, machine learning, scikit-learn, pandas, statistics",8.04,Data Scientist
"nlp, neural networks, mathematics, computer vision, python, deep learning, pytorch, data preprocessing",9.69,AI Engineer
"sql, java, node.js, databases, python, system design, api development, flask, authentication",7.29,Backend Developer
"flask, system design, django, databases, node.js, java",6.78,Backend Developer
"pytorch, mathematics, nlp, computer vision, tensorflow, python, machine learning",6.52,AI Engineer
"databases, sql, django, python, authentication, node.js, flask, java, api development",9.73,Backend Developer
"pytorch, mathematics, data preprocessing, deep learning, machine learning, python, neural networks, nlp, computer vision",7.91,AI Engineer
"linux, python, nlp, data preprocessing, machine learning, devops, tensorflow, deep learning, computer vision, neural networks, mathematics",9.05,AI Engineer
"computer vision, data preprocessing, pytorch, python, nlp, deep learning, machine learning, tensorflow, mathematics",7.6,AI Engineer
"statistics, hypothesis testing, scikit-learn, pandas, data visualization, python, machine learning, sql, numpy",9.09,Data Scientist
"debugging, git, problem solving, testing, data structures, oop, software design",9.17,Software Developer
"aws, networking, devops, monitoring, linux, kubernetes, terraform, ci/cd, docker",8.89,Cloud Engineer
"machine learning, nlp, computer vision, deep learning, mathematics, pytorch, python",7.96,AI Engineer
"computer vision, nlp, mathematics, tensorflow, neural networks, deep learning, data preprocessing, machine learning, python, pytorch",6.79,AI Engineer
"redux, javascript, typescript, accessibility, web performance, react, ui design, html",7.25,Frontend Developer
"pytorch, mathematics, deep learning, neural networks, tensorflow, nlp, incident response, data preprocessing, python, risk assessment, computer vision",9.08,AI Engineer
"networking, linux, ethical hacking, security, risk assessment, cryptography, firewalls",7.72,Cyber Security Analyst
"incident response, networking, ethical hacking, siem, security, risk assessment, linux",6.54,Cyber Security Analyst
"pytorch, python, tensorflow, neural networks, mathematics, nlp, computer vision, machine learning, data preprocessing, deep learning",6.45,AI Engineer
"risk assessment, incident response, penetration testing, sql, firewalls, cryptography, ethical hacking, networking",7.95,Cyber Security Analyst
"flask, api development, django, authentication, sql, incident response, system design, java, python, node.js, databases",6.89,Backend Developer
"javascript, html, typescript, responsive design, redux, ui design, css, react, accessibility",9.58,Frontend Developer
"testing, java, data structures, tensorflow, python, algorithms, oop, git",8.35,Software Developer
"css, ui design, accessibility, responsive design, html, react, javascript, redux, web performance",8.73,Frontend Developer
"mathematics, machine learning, tensorflow, algorithms, testing, python, neural networks, data preprocessing, nlp, pytorch",7.08,AI Engineer
"git, oop, deep learning, software design, python, testing, java, problem solving, data structures, debugging, computer vision, algorithms",9.75,Software Developer
"cryptography, ethical hacking, security, firewalls, linux, siem, incident response, penetration testing, excel, tableau, networking",9.57,Cyber Security Analyst
"html, css, javascript, accessibility, typescript, penetration testing, ui design, responsive design, siem, react, redux, web performance",8.07,Frontend Developer
"incident response, risk assessment, ethical hacking, siem, firewalls, cryptography, networking",7.47,Cyber Security Analyst
"testing, kubernetes, java, data structures, python, git, oop, algorithms, problem solving, software design, debugging, docker",6.64,Software Developer
"sql, flask, django, api development, node.js, system design, python",8.43,Backend Developer
"ci/cd, docker, monitoring, kubernetes, azure, aws, linux",8.76,Cloud Engineer
"css, web performance, accessibility, python, typescript, react, html, javascript, responsive design, ui design, redux",8.01,Frontend Developer
"tensorflow, redux, javascript, css, react, responsive design, html, web performance, ui design, typescript, accessibility",7.39,Frontend Developer
"pytorch, tensorflow, neural networks, mathematics, python, nlp, aws",9.72,AI Engineer
"software design, java, debugging, oop, problem solving, git, data structures, python, algorithms",7.14,Software Developer
"python, data structures, oop, algorithms, testing, problem solving, debugging, software design, git",9.41,Software Developer
"excel, sql, tableau, power bi, reporting, data cleaning",7.19,Data Analyst
"neural networks, deep learning, nlp, tableau, mathematics, computer vision, tensorflow, statistics, data preprocessing",8.32,AI Engineer
"docker, networking, azure, monitoring, devops, linux, aws, ci/cd, terraform, kubernetes",6.05,Cloud Engineer
"computer vision, data preprocessing, nlp, python, pytorch, tensorflow, neural networks, machine learning, linux",7.22,AI Engineer
"pandas, data cleaning, power bi, tableau, statistics, sql, reporting, data visualization, tensorflow, python",6.41,Data Analyst
"web performance, ui design, accessibility, oop, typescript, react, html, javascript",7.28,Frontend Developer
"sql, feature engineering, hypothesis testing, pandas, scikit-learn, numpy, statistics",8.96,Data Scientist
"feature engineering, data visualization, statistics, hypothesis testing, incident response, machine learning, python, sql, scikit-learn",8.91,Data Scientist
"pytorch, tensorflow, data preprocessing, neural networks, nlp, python, mathematics, computer vision",7.65,AI Engineer
"penetration testing, siem, risk assessment, linux, cryptography, incident response, firewalls, security, networking, ethical hacking",9.12,Cyber Security Analyst
"data cleaning, pandas, reporting, python, excel, data visualization, power bi, statistics, tableau, penetration testing",8.74,Data Analyst
"pandas, feature engineering, numpy, scikit-learn, statistics, hypothesis testing, python, data visualization",8.13,Data Scientist
"tensorflow, pytorch, nlp, neural networks, machine learning, python, computer vision",6.36,AI Engineer
"nlp, neural networks, tensorflow, computer vision, pandas, data preprocessing, mathematics, pytorch, python, numpy, deep learning",8.76,AI Engineer
"firewalls, ethical hacking, siem, security, penetration testing, linux, cryptography, risk assessment, networking, incident response",8.36,Cyber Security Analyst
"numpy, pandas, data visualization, statistics, feature engineering, hypothesis testing, python, machine learning, scikit-learn, sql",9.14,Data Scientist
"sql, system design, reporting, java, statistics, databases, node.js, django, flask, api development, authentication, python",8.48,Backend Developer
"flask, api development, sql, databases, authentication, java, python, django, node.js, system design",7.22,Backend Developer
"css, javascript, web performance, responsive design, react, typescript, accessibility",6.47,Frontend Developer
"tensorflow, pytorch, python, deep learning, neural networks, nlp, mathematics, accessibility, machine learning, data preprocessing",8.04,AI Engineer
"data visualization, power bi, reporting, statistics, python, data cleaning",7.39,Data Analyst
"system design, api development, python, django, sql, flask, authentication, java",9.56,Backend Developer
"neural networks, nlp, computer vision, python, deep learning, mathematics, data preprocessing, tensorflow, pytorch, machine learning",7.96,AI Engineer
"firewalls, risk assessment, incident response, penetration testing, linux, security, cryptography, networking, siem",9.14,Cyber Security Analyst
"pandas, reporting, statistics, data cleaning, power bi, data visualization, python, excel, feature engineering, tableau, sql",7.05,Data Analyst
"redux, typescript, javascript, responsive design, css, html, accessibility, ui design, web performance",8.43,Frontend Developer
"devops, kubernetes, monitoring, terraform, docker, aws, networking",9.61,Cloud Engineer
"sql, linux, terraform, azure, aws, docker, scikit-learn, networking, devops, kubernetes, monitoring",8.25,Cloud Engineer
"hypothesis testing, sql, machine learning, feature engineering, statistics, numpy, scikit-learn, python, data visualization",7.46,Data Scientist
"terraform, monitoring, aws, ci/cd, kubernetes, networking, docker, azure",8.75,Cloud Engineer
"accessibility, monitoring, kubernetes, redux, docker, terraform, aws, linux",8.59,Cloud Engineer
"python, node.js, system design, databases, api development, django, authentication",7.67,Backend Developer
"python, debugging, data structures, oop, algorithms, testing, problem solving",8.8,Software Developer
"sql, numpy, feature engineering, python, statistics, machine learning, hypothesis testing",7.63,Data Scientist
"machine learning, numpy, sql, statistics, python, data visualization",7.58,Data Scientist
"security, linux, risk assessment, networking, firewalls, incident response, siem, penetration testing, ethical hacking",7.88,Cyber Security Analyst
"python, flask, api development, authentication, system design, databases, django",6.39,Backend Developer
"scikit-learn, machine learning, data visualization, pandas, feature engineering, ethical hacking, hypothesis testing, sql, penetration testing",6.02,Data Scientist
"testing, problem solving, computer vision, git, data structures, algorithms, oop",7.07,Software Developer
"flask, sql, java, databases, python, api development, authentication, node.js, django",7.76,Backend Developer
"javascript, css, web performance, react, accessibility, redux, typescript, html",9.11,Frontend Developer
"system design, java, authentication, sql, api development, node.js, django",9.24,Backend Developer
"html, react, responsive design, web performance, javascript, css, redux, accessibility",6.2,Frontend Developer
"monitoring, ci/cd, docker, azure, kubernetes, machine learning, aws, terraform, hypothesis testing, devops, linux",7.77,Cloud Engineer
"linux, azure, aws, ci/cd, networking, monitoring, kubernetes, devops",8.69,Cloud Engineer
"debugging, networking, incident response, ethical hacking, problem solving, risk assessment, security, cryptography, firewalls",8.06,Cyber Security Analyst
"docker, kubernetes, monitoring, azure, linux, networking",6.97,Cloud Engineer
"networking, linux, monitoring, kubernetes, docker, terraform, devops, azure",9.58,Cloud Engineer
"networking, aws, terraform, devops, linux, ci/cd, azure, monitoring, docker, kubernetes",6.28,Cloud Engineer
"risk assessment, penetration testing, siem, node.js, ethical hacking, authentication, cryptography, linux, networking",8.24,Cyber Security Analyst
"javascript, typescript, redux, html, web performance, responsive design",6.36,Frontend Developer
"machine learning, python, deep learning, computer vision, data preprocessing, mathematics, tensorflow",7.49,AI Engineer
"software design, oop, data structures, debugging, algorithms, git",9.24,Software Developer
"responsive design, problem solving, ui design, javascript, accessibility, web performance, html, typescript, redux, react, debugging, css",8.4,Frontend Developer
"algorithms, problem solving, software design, testing, java, debugging",8.23,Software Developer
"excel, python, responsive design, tableau, power bi, data cleaning, typescript, reporting, pandas, data visualization",9.63,Data Analyst
"terraform, linux, machine learning, kubernetes, sql, ci/cd, azure, aws",8.88,Cloud Engineer
"sql, hypothesis testing, scikit-learn, pandas, machine learning, python, feature engineering, statistics, numpy, data visualization",6.15,Data Scientist
"risk assessment, linux, networking, cryptography, incident response, firewalls, penetration testing",8.3,Cyber Security Analyst
"data cleaning, reporting, sql, pandas, python, power bi, excel",7.91,Data Analyst
"algorithms, java, data structures, testing, python, software design, problem solving, git, debugging",8.31,Software Developer
"ui design, redux, typescript, javascript, ethical hacking, web performance, css, html, risk assessment, responsive design",9.72,Frontend Developer
"networking, azure, ci/cd, docker, kubernetes, devops",6.11,Cloud Engineer
"data visualization, reporting, sql, power bi, pandas, data cleaning, excel, python, statistics",6.55,Data Analyst
"excel, python, data cleaning, docker, pandas, tableau, power bi",8.97,Data Analyst
"pandas, tableau, reporting, data cleaning, statistics, power bi, excel, sql, data visualization, python",6.52,Data Analyst
"problem solving, debugging, software design, testing, networking, oop, java, git",9.28,Software Developer
"api development, authentication, django, tensorflow, flask, java, nlp, sql, system design, databases, python, node.js",7.32,Backend Developer
"node.js, system design, python, flask, java, sql, api development",7.94,Backend Developer
"software design, java, python, flask, system design, sql, problem solving, django, api development",9.23,Backend Developer
"data visualization, statistics, python, power bi, tableau, excel, data cleaning, sql, pandas",6.36,Data Analyst
"software design, testing, debugging, git, data structures, algorithms, problem solving, oop",6.65,Software Developer
"python, sql, authentication, api development, system design, flask, django, databases, node.js",8.62,Backend Developer
"javascript, web performance, css, ui design, accessibility, typescript, react, responsive design",7.94,Frontend Developer
"accessibility, react, web performance, javascript, ui design, deep learning, css, responsive design",6.49,Frontend Developer
"excel, python, sql, data visualization, data cleaning, power bi, tableau, statistics, pandas",6.75,Data Analyst
"software design, aws, debugging, ci/cd, algorithms, testing, data structures, java, oop",6.17,Software Developer
"devops, azure, terraform, networking, kubernetes, monitoring, linux, ci/cd, aws, docker",6.87,Cloud Engineer
"machine learning, incident response, siem, networking, security, cryptography, penetration testing, linux, ethical hacking, deep learning, firewalls",7.9,Cyber Security Analyst
"pandas, authentication, system design, flask, python, api development, databases, sql, node.js, django",9.54,Backend Developer
"system design, cryptography, sql, python, authentication, flask, databases, django",8.54,Backend Developer
"numpy, hypothesis testing, feature engineering, statistics, python, machine learning, sql",9.02,Data Scientist
"debugging, python, algorithms, testing, git, oop, problem solving",7.46,Software Developer
"data visualization, reporting, data cleaning, databases, tableau, sql, power bi",8.59,Data Analyst
"statistics, data visualization, excel, python, power bi, sql, reporting, data cleaning",9.35,Data Analyst
"aws, kubernetes, ci/cd, monitoring, linux, terraform, azure, networking, devops",8.21,Cloud Engineer
"java, data structures, css, debugging, oop, algorithms, javascript, python, git, testing, problem solving, software design",9.22,Software Developer
"software design, algorithms, data structures, oop, testing, debugging, java, problem solving, git",6.89,Software Developer
"mathematics, tensorflow, deep learning, nlp, pytorch, computer vision, data preprocessing, neural networks, machine learning, python",9.77,AI Engineer
"machine learning, python, sql, data visualization, numpy, feature engineering, scikit-learn, statistics",9.73,Data Scientist
"accessibility, nlp, machine learning, pytorch, python, neural networks, deep learning, data preprocessing, mathematics",7.94,AI Engineer
"data preprocessing, deep learning, nlp, python, computer vision, mathematics, machine learning",7.63,AI Engineer
"scikit-learn, python, data visualization, pandas, feature engineering, statistics, machine learning",9.28,Data Scientist
"azure, aws, kubernetes, terraform, devops, monitoring, docker, linux, networking",9.02,Cloud Engineer
"web performance, ui design, html, typescript, css, accessibility, redux",8.86,Frontend Developer
"web performance, responsive design, javascript, html, react, css, ui design",7.26,Frontend Developer
"python, oop, problem solving, debugging, software design, testing, data structures, java",8.63,Software Developer
"redux, html, web performance, typescript, css, javascript, react, responsive design, accessibility",7.45,Frontend Developer
"ci/cd, terraform, kubernetes, azure, monitoring, devops, docker, linux, aws, networking",9.03,Cloud Engineer
"python, flask, system design, api development, authentication, node.js, django, sql, databases, java",7.55,Backend Developer
"python, pandas, statistics, numpy, data visualization, machine learning",9.36,Data Scientist
"flask, java, api development, databases, system design, django",9.3,Backend Developer
"tableau, statistics, incident response, pandas, data visualization, reporting, security, sql, python, power bi",6.43,Data Analyst
"statistics, tableau, pandas, python, data cleaning, data visualization, excel, sql, power bi",8.63,Data Analyst
"firewalls, networking, penetration testing, linux, risk assessment, cryptography",6.82,Cyber Security Analyst
"siem, risk assessment, incident response, penetration testing, firewalls, linux, networking",9.36,Cyber Security Analyst
"statistics, sql, feature engineering, data visualization, python, hypothesis testing, pandas, scikit-learn, numpy",9.8,Data Scientist
"data visualization, ethical hacking, risk assessment, siem, incident response, sql, firewalls, linux",9.12,Cyber Security Analyst
"data cleaning, power bi, python, statistics, data visualization, excel, hypothesis testing, reporting, pandas, tableau, sql",7.05,Data Analyst
"mathematics, python, neural networks, deep learning, machine learning, computer vision, pytorch, nlp",6.73,AI Engineer
"terraform, ci/cd, docker, networking, kubernetes, monitoring, devops, linux, azure",7.9,Cloud Engineer
"siem, python, django, sql, networking, api development, authentication, node.js",8.15,Backend Developer
"debugging, testing, oop, software design, api development, problem solving, algorithms",8.31,Software Developer
"sql, reporting, data visualization, pandas, power bi, python, data cleaning, excel",7.03,Data Analyst
"reporting, computer vision, data visualization, power bi, data cleaning, tableau, sql",9.03,Data Analyst
"html, typescript, react, responsive design, css, accessibility, ui design, javascript, redux, web performance",7.11,Frontend Developer
"system design, python, node.js, flask, api development, authentication, databases, django, java, sql",9.7,Backend Developer
"java, hypothesis testing, git, python, data structures, debugging, software design, problem solving, oop, algorithms, testing",6.21,Software Developer
"ethical hacking, incident response, networking, siem, penetration testing, security, linux",8.84,Cyber Security Analyst
"ethical hacking, risk assessment, linux, cryptography, firewalls, security, machine learning, penetration testing",8.4,Cyber Security Analyst
"hypothesis testing, machine learning, feature engineering, sql, data visualization, python",7.0,Data Scientist
"pandas, numpy, statistics, python, machine learning, scikit-learn, hypothesis testing, feature engineering, sql, data visualization",9.63,Data Scientist
"firewalls, security, networking, linux, incident response, cryptography, ethical hacking, penetration testing, django, databases",9.7,Cyber Security Analyst
"numpy, sql, django, databases, authentication, java, flask, python, node.js",8.36,Backend Developer
"ui design, redux, responsive design, css, web performance, typescript, react",6.52,Frontend Developer
"java, oop, problem solving, algorithms, testing, data structures",8.63,Software Developer
"python, flask, node.js, sql, authentication, django, api development",6.43,Backend Developer
"java, software design, debugging, testing, oop, data structures, python, problem solving, algorithms",9.05,Software Developer
"python, api development, flask, authentication, system design, databases, node.js, django, sql, aws",6.79,Backend Developer
"web performance, responsive design, css, redux, react, html",7.63,Frontend Developer
"pandas, power bi, data visualization, excel, data cleaning, reporting, tableau, python, sql, statistics",8.82,Data Analyst
"cryptography, incident response, firewalls, penetration testing, networking, risk assessment, linux, security, ethical hacking",8.75,Cyber Security Analyst
"networking, docker, terraform, kubernetes, ci/cd, monitoring, devops, azure, linux, aws",7.33,Cloud Engineer
"data visualization, python, reporting, power bi, tableau, excel, oop, statistics, pandas, data cleaning",7.08,Data Analyst
"html, javascript, web performance, ui design, accessibility, redux, typescript, react, css, django",9.01,Frontend Developer
"firewalls, ethical hacking, siem, networking, incident response, cryptography, penetration testing, security, risk assessment, linux",8.32,Cyber Security Analyst
"django, pandas, python, system design, node.js, authentication, sql",8.64,Backend Developer
"authentication, node.js, api development, databases, flask, java, system design, python",8.66,Backend Developer
"pandas, sql, tableau, data cleaning, excel, data visualization, reporting, python, power bi",7.55,Data Analyst
"monitoring, tableau, devops, linux, aws, kubernetes, terraform, reporting",7.02,Cloud Engineer
"react, redux, html, accessibility, ui design, responsive design, typescript, javascript, web performance, css",6.94,Frontend Developer
"data visualization, feature engineering, statistics, machine learning, pandas, scikit-learn, numpy, sql, hypothesis testing",6.81,Data Scientist
"authentication, java, api development, flask, databases, node.js, system design",9.38,Backend Developer
"terraform, aws, devops, networking, docker, linux",7.8,Cloud Engineer
"javascript, web performance, typescript, css, react, html, redux, ui design, accessibility",7.82,Frontend Developer
"incident response, linux, ethical hacking, firewalls, penetration testing, siem, networking, security, cryptography, risk assessment",9.82,Cyber Security Analyst
"debugging, oop, testing, system design, algorithms, python, problem solving, data structures, git, software design, authentication",9.54,Software Developer
"sql, reporting, statistics, data visualization, pandas, data cleaning, power bi, python",8.36,Data Analyst
"networking, monitoring, linux, terraform, kubernetes, azure",7.19,Cloud Engineer
